{
  "allowlist": [
    {
      "id": "pinned-dependency-email-identifier-01",
      "match_sha256": "02e36d491e64d51d4a6ef2c039b2a1543cb47b8f595f653e84dd1b27b9fd9625",
      "path": "imsg",
      "reason": "Public author/contact metadata embedded in an exact pinned dependency release.",
      "reviewer": "repository-maintainer",
      "rule": "email_identifier"
    },
    {
      "id": "pinned-dependency-email-identifier-02",
      "match_sha256": "0c7e6a405862e402eb76a70f8a26fc732d07c32931e9fae9ab1582911d2e8a3b",
      "path": "imsg",
      "reason": "Public author/contact metadata embedded in an exact pinned dependency release.",
      "reviewer": "repository-maintainer",
      "rule": "email_identifier"
    },
    {
      "id": "pinned-dependency-email-identifier-03",
      "match_sha256": "f404d23e04b75bb8e170828b559cc8a448b1c3749344c39e8d4a8355b76496fe",
      "path": "cryptography-49.0.0.dist-info/METADATA",
      "reason": "Public author/contact metadata embedded in an exact pinned dependency release.",
      "reviewer": "repository-maintainer",
      "rule": "email_identifier"
    },
    {
      "id": "pinned-dependency-email-identifier-04",
      "match_sha256": "1b66d15555ffd43b877c9384d5fc820037f836087979311418422028b22c1315",
      "path": "cryptography-49.0.0.dist-info/sboms/cryptography-rust.cyclonedx.json",
      "reason": "Public author/contact metadata embedded in an exact pinned dependency release.",
      "reviewer": "repository-maintainer",
      "rule": "email_identifier"
    },
    {
      "id": "pinned-dependency-email-identifier-05",
      "match_sha256": "3662f957bb6831fe669259d3505d8b56028661fed5aacf934f7d8e73c6042d39",
      "path": "cryptography-49.0.0.dist-info/sboms/cryptography-rust.cyclonedx.json",
      "reason": "Public author/contact metadata embedded in an exact pinned dependency release.",
      "reviewer": "repository-maintainer",
      "rule": "email_identifier"
    },
    {
      "id": "pinned-dependency-email-identifier-06",
      "match_sha256": "383332bb72c008ef22efd2a9d0d132c12529f2261ffed65279ebcc1fd8dc4229",
      "path": "cryptography-49.0.0.dist-info/sboms/cryptography-rust.cyclonedx.json",
      "reason": "Public author/contact metadata embedded in an exact pinned dependency release.",
      "reviewer": "repository-maintainer",
      "rule": "email_identifier"
    },
    {
      "id": "pinned-dependency-email-identifier-07",
      "match_sha256": "424fa24408d96bd43a1c77757b8b16118a1984cc1c29bab7f4a576c6bdf549d3",
      "path": "cryptography-49.0.0.dist-info/sboms/cryptography-rust.cyclonedx.json",
      "reason": "Public author/contact metadata embedded in an exact pinned dependency release.",
      "reviewer": "repository-maintainer",
      "rule": "email_identifier"
    },
    {
      "id": "pinned-dependency-email-identifier-08",
      "match_sha256": "6cab2051eaee8ec19d284a04ff96f989f40917dbeebc3e4a56603dd1b062bd7b",
      "path": "cryptography-49.0.0.dist-info/sboms/cryptography-rust.cyclonedx.json",
      "reason": "Public author/contact metadata embedded in an exact pinned dependency release.",
      "reviewer": "repository-maintainer",
      "rule": "email_identifier"
    },
    {
      "id": "pinned-dependency-email-identifier-09",
      "match_sha256": "9b5604521065943f9569a76b535e2425048a200e0c3166e127b81ff3c8970346",
      "path": "cryptography-49.0.0.dist-info/sboms/cryptography-rust.cyclonedx.json",
      "reason": "Public author/contact metadata embedded in an exact pinned dependency release.",
      "reviewer": "repository-maintainer",
      "rule": "email_identifier"
    },
    {
      "id": "pinned-dependency-email-identifier-10",
      "match_sha256": "a08ad6dcb2d97de9309d2d428fad05a284fc0f0ddfa1b1bdb3a9144870eefebb",
      "path": "cryptography-49.0.0.dist-info/sboms/cryptography-rust.cyclonedx.json",
      "reason": "Public author/contact metadata embedded in an exact pinned dependency release.",
      "reviewer": "repository-maintainer",
      "rule": "email_identifier"
    },
    {
      "id": "pinned-dependency-email-identifier-11",
      "match_sha256": "a4ba7c78529398a6d538a99dff0eb515d7e784c6802abcb2e1cf10470d8ac362",
      "path": "cryptography-49.0.0.dist-info/sboms/cryptography-rust.cyclonedx.json",
      "reason": "Public author/contact metadata embedded in an exact pinned dependency release.",
      "reviewer": "repository-maintainer",
      "rule": "email_identifier"
    },
    {
      "id": "pinned-dependency-email-identifier-12",
      "match_sha256": "ac33150400b6c974ea32f0430e9ad15b4e4499a05b68971414cb330b446c17b0",
      "path": "cryptography-49.0.0.dist-info/sboms/cryptography-rust.cyclonedx.json",
      "reason": "Public author/contact metadata embedded in an exact pinned dependency release.",
      "reviewer": "repository-maintainer",
      "rule": "email_identifier"
    },
    {
      "id": "pinned-dependency-email-identifier-13",
      "match_sha256": "afec846f9ec8c0bfcecc15976a33a5870dcd01e048eab64b6f290bf0a20825a7",
      "path": "cryptography-49.0.0.dist-info/sboms/cryptography-rust.cyclonedx.json",
      "reason": "Public author/contact metadata embedded in an exact pinned dependency release.",
      "reviewer": "repository-maintainer",
      "rule": "email_identifier"
    },
    {
      "id": "pinned-dependency-email-identifier-14",
      "match_sha256": "b431f90f84b3c587600e3fd618708e13bf7ebebf5c34adb92ed3641b593b0112",
      "path": "cryptography-49.0.0.dist-info/sboms/cryptography-rust.cyclonedx.json",
      "reason": "Public author/contact metadata embedded in an exact pinned dependency release.",
      "reviewer": "repository-maintainer",
      "rule": "email_identifier"
    },
    {
      "id": "pinned-dependency-email-identifier-15",
      "match_sha256": "b6d3e1c1f4b83f92ac42e6d7c7869ac284ec4864eb1eae0f9e4191eb57724e1f",
      "path": "cryptography-49.0.0.dist-info/sboms/cryptography-rust.cyclonedx.json",
      "reason": "Public author/contact metadata embedded in an exact pinned dependency release.",
      "reviewer": "repository-maintainer",
      "rule": "email_identifier"
    },
    {
      "id": "pinned-dependency-email-identifier-16",
      "match_sha256": "b7310ddcd52d4463b3d800233863720784da06704d6023d975d35bc61b3b8bef",
      "path": "cryptography-49.0.0.dist-info/sboms/cryptography-rust.cyclonedx.json",
      "reason": "Public author/contact metadata embedded in an exact pinned dependency release.",
      "reviewer": "repository-maintainer",
      "rule": "email_identifier"
    },
    {
      "id": "pinned-dependency-email-identifier-17",
      "match_sha256": "cf73037cc6982895437e531b02add01d8c9e9be1c04a8fe6d9d09893df1a7fe7",
      "path": "cryptography-49.0.0.dist-info/sboms/cryptography-rust.cyclonedx.json",
      "reason": "Public author/contact metadata embedded in an exact pinned dependency release.",
      "reviewer": "repository-maintainer",
      "rule": "email_identifier"
    },
    {
      "id": "pinned-dependency-email-identifier-18",
      "match_sha256": "f19aad35f4f337293d94a0ec5edf4f2f040fa41c36a89a4eea47957b91add784",
      "path": "cryptography-49.0.0.dist-info/sboms/cryptography-rust.cyclonedx.json",
      "reason": "Public author/contact metadata embedded in an exact pinned dependency release.",
      "reviewer": "repository-maintainer",
      "rule": "email_identifier"
    },
    {
      "id": "pinned-dependency-email-identifier-19",
      "match_sha256": "f404d23e04b75bb8e170828b559cc8a448b1c3749344c39e8d4a8355b76496fe",
      "path": "cryptography-49.0.0.dist-info/sboms/cryptography-rust.cyclonedx.json",
      "reason": "Public author/contact metadata embedded in an exact pinned dependency release.",
      "reviewer": "repository-maintainer",
      "rule": "email_identifier"
    },
    {
      "id": "pinned-dependency-email-identifier-20",
      "match_sha256": "f6efa5ad4a4e2d5f92b5e9514b4a65eb4c84aa7dd88ee23051e26e5a23d01229",
      "path": "cryptography-49.0.0.dist-info/sboms/cryptography-rust.cyclonedx.json",
      "reason": "Public author/contact metadata embedded in an exact pinned dependency release.",
      "reviewer": "repository-maintainer",
      "rule": "email_identifier"
    },
    {
      "id": "pinned-dependency-email-identifier-21",
      "match_sha256": "571f8ff4c960d22d9d8bb0137ce8c01238ec95cb8a846ff63e3d0b639ba7f6a0",
      "path": "cryptography/hazmat/primitives/serialization/ssh.py",
      "reason": "Public author/contact metadata embedded in an exact pinned dependency release.",
      "reviewer": "repository-maintainer",
      "rule": "email_identifier"
    },
    {
      "id": "pinned-dependency-email-identifier-22",
      "match_sha256": "6c29dedc082c66222a09cbe21d37c05dddb07bcd28ed75f2bd4ec756c736df37",
      "path": "cryptography/hazmat/primitives/serialization/ssh.py",
      "reason": "Public author/contact metadata embedded in an exact pinned dependency release.",
      "reviewer": "repository-maintainer",
      "rule": "email_identifier"
    },
    {
      "id": "pinned-dependency-email-identifier-23",
      "match_sha256": "6f5a890134440ca71850e8d6ba3bec68cf23ab5e17961b4fbcb8a8180aa094ae",
      "path": "cryptography/hazmat/primitives/serialization/ssh.py",
      "reason": "Public author/contact metadata embedded in an exact pinned dependency release.",
      "reviewer": "repository-maintainer",
      "rule": "email_identifier"
    },
    {
      "id": "pinned-dependency-email-identifier-24",
      "match_sha256": "9621b539252016e6dfca1c07d5f17929cac8b92786543fd6f12b21df5ba9503a",
      "path": "cryptography/hazmat/primitives/serialization/ssh.py",
      "reason": "Public author/contact metadata embedded in an exact pinned dependency release.",
      "reviewer": "repository-maintainer",
      "rule": "email_identifier"
    },
    {
      "id": "pinned-dependency-email-identifier-25",
      "match_sha256": "319cf4140a42bb1c9b9b48164e6b7e6e157d343f66e44dc6903c5022166a891b",
      "path": "pycparser-3.0.dist-info/METADATA",